{
  "schema": "bsx.work_order",
  "schema_version": 1,
  "contract_id": "ashfall_crew.vs102",
  "issued_at": "2026-10-20T09:00:00Z",
  "client": {
    "company": "ashfall_crew",
    "display_name": "Ashfall Crew",
    "game": "void_salvage"
  },
  "ship": {
    "ship_id": "ashfall_crew/manta",
    "design": "manta",
    "current_fit": [
      {
        "slot": "hold_module_1",
        "component": {
          "id": "hold_net"
        },
        "condition": 0.7
      }
    ]
  },
  "changes": [
    {
      "change_id": "c1",
      "action": "replace",
      "slot": "hold_module_1",
      "remove": {
        "id": "hold_net"
      },
      "install": {
        "id": "attractor_coil_1",
        "material": "copper"
      },
      "notes": "Keep the old nets, we want them back."
    }
  ],
  "manifest": [
    {
      "line_id": "m1",
      "component": {
        "id": "attractor_coil_1"
      },
      "qty": 1,
      "supplied_by": "bsx",
      "allowed_sources": [
        "new",
        "refurbished"
      ]
    }
  ],
  "spec_sheet": {
    "library": true,
    "overrides": [
      {
        "change_id": "c1",
        "bolt": {
          "torque_nm": 200,
          "pattern": "star"
        }
      }
    ]
  },
  "notes": [
    {
      "text": "Coil feed must land on the hold breaker.",
      "change_id": "c1"
    }
  ],
  "commercial": {
    "price": 9800,
    "currency": "cr",
    "deposit_pct": 30,
    "due_day": 5
  }
}