{
  "schema": "bsx.work_order",
  "schema_version": 1,
  "contract_id": "rook_salvage.vs103",
  "issued_at": "2026-10-20T09:00:00Z",
  "client": {
    "company": "rook_salvage",
    "display_name": "Rook Salvage",
    "game": "void_salvage"
  },
  "ship": {
    "ship_id": "rook_salvage/kestrel",
    "design": "kestrel",
    "current_fit": []
  },
  "changes": [
    {
      "change_id": "c1",
      "action": "add",
      "slot": "roof_module_1",
      "install": {
        "id": "survey_array"
      }
    }
  ],
  "manifest": [
    {
      "line_id": "m1",
      "component": {
        "id": "survey_array"
      },
      "qty": 1,
      "supplied_by": "bsx",
      "allowed_sources": [
        "new"
      ]
    }
  ],
  "spec_sheet": {
    "library": true,
    "overrides": []
  },
  "notes": [
    {
      "text": "We want to see wrecks before we jump to them.",
      "change_id": ""
    }
  ],
  "commercial": {
    "price": 7600,
    "currency": "cr",
    "deposit_pct": 30,
    "due_day": 6
  }
}